userName,score,content,at,thumbsUpCount,source,app,score_based,rule_based,final_label
Fig “Tasty” Newton,1,your ai inclusion ha destroyed the app experience for me item option do not load well at all half the time it freeze the app and just gray out the option and price area while failing to respond yall have absolutely no clue what youre doing huh,2026-03-07 18:28:17,1,amzon_reviews,unknown,Negative,Negative,Negative
somrat sk,5,good,2026-02-27 07:22:02,0,noon_reviews,unknown,Positive,Positive,Positive
Eulalio Loya,5,i been mostly good couple of mistake but is been good,2026-03-12 19:08:36,0,temu_reviews,unknown,Positive,Positive,Positive
Shandella brown,5,love it,2026-03-12 00:40:24,0,temu_reviews,unknown,Positive,Positive,Positive
Penelope Richards-Scott,5,love them,2026-03-12 01:29:33,0,temu_reviews,unknown,Positive,Positive,Positive
Muhammad Ghafran,5,good,2026-02-26 11:57:53,0,noon_reviews,unknown,Positive,Positive,Positive
chris Fourzan,1,worse than temu delivey time is terrible rather order from tiktok because they ship in 3 day,2026-02-27 17:25:03,0,ali-express_reviews,unknown,Negative,Negative,Negative
jasson melendez,5,excellent product thank you temu,2026-03-12 15:24:28,0,temu_reviews,unknown,Positive,Positive,Positive
Africa J.,1,i dont know what type of update amazon had recently but i can no longer purchase thing in my cart everytime i go to checkout an error page keep popping up,2026-03-05 21:52:02,0,amzon_reviews,unknown,Negative,Negative,Negative
Nabeel Farooq,5,excellent app quick service,2026-03-04 15:33:32,0,noon_reviews,unknown,Positive,Positive,Positive
Muhammed Umar Maroof Khan,5,quick ordering easy,2026-03-04 21:55:03,0,noon_reviews,unknown,Positive,Neutral,Positive
Him Laif,1,beware aliexpress will not refund order in package for which sister company cainiao logistics alibaba group issued proof of loss document,2026-03-03 01:28:12,1,ali-express_reviews,unknown,Negative,Negative,Negative
C A,1,stuff get delivered literally whenever if i order next day delivery it arrives in 3 day if i order a specific delivery day they deliver it on a different day when im not home or my favorite theyll make 4 different delivery to my house on the same day absolute stupidity,2026-03-12 20:34:26,0,amzon_reviews,unknown,Negative,Negative,Negative
haji ajis haji bangok,5,good,2026-03-12 04:14:00,0,temu_reviews,unknown,Positive,Positive,Positive
Fredric Reider,4,i love how convenient it is but occasionally like today it unusable update issue most likely hopefully it will work tomorrow,2026-03-05 23:46:56,0,amzon_reviews,unknown,Positive,Positive,Positive
Mohammed Ashraf,5,nice,2026-03-06 19:30:14,0,noon_reviews,unknown,Positive,Positive,Positive
Musa Bahi,5,i really like this application i can get everything from home and it is very fast thank you noon,2026-03-05 14:15:38,0,noon_reviews,unknown,Positive,Positive,Positive
Henry Giroir Jr.,4,easiest way to shop for hard to find thing,2026-03-10 21:18:43,0,amzon_reviews,unknown,Positive,Neutral,Positive
Marcie Graham,1,never got my stuff they lied about the mailing source dont trust them i lost out on my money too temu is better,2026-03-11 21:53:27,0,ali-express_reviews,unknown,Negative,Negative,Negative
Rahmat Khan,5,good,2026-02-28 12:22:06,0,noon_reviews,unknown,Positive,Positive,Positive
jzimme248,1,did a recommended update today on the app and now i can no longer check out and make a purchase nor can i view review or product detail what in the world amazon fix this asap because if customer can not order you will be losing a lot of money very quickly super frustrating and i hope this is fixed,2026-03-06 00:05:07,0,amzon_reviews,unknown,Negative,Negative,Negative
Craig Maybury,1,the app is crashing constantly now i cant acess the play and earm area at all,2026-03-11 02:53:35,0,ali-express_reviews,unknown,Negative,Neutral,Negative
ulises sanchez,5,fast service and if they screw it they fixt it,2026-03-06 00:38:21,0,amzon_reviews,unknown,Positive,Positive,Positive
Jamila Fekry,5,very good,2026-03-02 20:34:24,0,noon_reviews,unknown,Positive,Positive,Positive
Andri Pech,1,the seller canceled my order and made a refund but i cant withdraw my money because the app doe not accept a withdraw by using your original methodpayment i paid by oxxo so my money turned into a frozen refund that im uncapable to withdraw in a nutshell i wasted money and time,2026-03-01 01:37:50,1,ali-express_reviews,unknown,Negative,Negative,Negative
Dark King35,4,so far every order i want came a expected,2026-03-08 00:44:50,0,amzon_reviews,unknown,Positive,Neutral,Positive
Umer Zfold,5,good,2026-02-27 21:56:36,0,noon_reviews,unknown,Positive,Positive,Positive
James Morgan,1,scam central avoid like the plague,2026-02-18 21:49:01,0,ali-express_reviews,unknown,Negative,Neutral,Negative
Joshua Carter,1,what a scam they will tell you thing are delivered and when they were not if you then utilize the chat to ask about it you get some ai chatbot in china that doe nothing for you im out money now with no product to show for it,2026-02-28 07:59:14,1,ali-express_reviews,unknown,Negative,Negative,Negative
György Nándor Traser,1,a temu egy agresszív vírus nem lehet kiirtani egy kész katasztrófa,2026-03-12 22:15:02,0,temu_reviews,unknown,Negative,Neutral,Negative
Phyllis Jackson,5,i think they deserve a five star bc amazon truly try to assist support customer who dont understand the app plus assist with replacing or reordering outcast purchase and if this doesnt resolve the issue at hand theyll refund your total fund ive unbelievably received all fund into my account thanks amazon team for going above and beyond expectation in solving issue with vender from another satisfied customer,2026-03-12 08:50:19,0,amzon_reviews,unknown,Positive,Neutral,Positive
Oryiman Obem,5,mobilebook,2026-03-11 22:16:07,0,temu_reviews,unknown,Positive,Neutral,Positive
Philip Brady,5,really positive with 95 of tbe vendor,2026-03-08 10:33:57,0,ali-express_reviews,unknown,Positive,Neutral,Positive
Boda Mahmoud,5,easy to use,2026-03-12 22:21:35,0,noon_reviews,unknown,Positive,Neutral,Positive
Jennie Beswick,1,great product awful service why cant you make it easy to turn off 1 click ive deleted my payment option and i put them in each time and then delete horrible security im no longer buying from amazon unless there is no other way deleting the app,2026-03-06 04:09:39,1,amzon_reviews,unknown,Negative,Neutral,Negative
Dontae Hufflin,5,awesome service never have had a single issue they send what is advertised every single time and you cant beat their price or their product temu wish have nothing on aliexpress,2026-03-11 21:14:59,0,ali-express_reviews,unknown,Positive,Negative,Positive
