userName,score,content,at,thumbsUpCount,source,app
Kayanat Anika,1,honestly i think there is a problem cuz i cant download it,2026-03-12 23:21:40,0,ali-express_reviews,unknown
Nunya Biz,5,apparently when i set setting for notification and turn off specific one because i hate being spammed your company ignores it i dont need to be notified 5 time a day because you think i need to know that fingernail clipper are on sale stop it,2026-03-12 22:42:39,4,ali-express_reviews,unknown
Samarth Sandeep,1,this is by far the worst app i have bought 3 product from it and non of them have came and when i contact the shipping company they instantly hang up highly whould not recommend most of the 5 star review are probobly bot and this is one of the worst apps do not install or use and the same happend to my friend,2026-03-12 22:14:26,0,ali-express_reviews,unknown
Rubysu aka Natalie Debler,3,my first package arrived but with counterfeit postage i had to pay an extra 1375 to get from my local post office i hope the other 2 do not happen this way,2026-03-12 21:38:03,0,ali-express_reviews,unknown
Toni Dawn Moore,4,never shopped there yet,2026-03-12 21:24:39,0,ali-express_reviews,unknown
Asia Johnson,3,buy from these guy,2026-03-12 20:36:18,0,ali-express_reviews,unknown
Lebohang Pasane,1,worst experience ever they were so nice before i bought but after i bought they became cold and negligent they lied and said my order is in my country but it never arrived if thats how they go about scamming people judgement is surely to befall them i forgive you no string attached i just feel sorry for you,2026-03-12 20:04:32,0,ali-express_reviews,unknown
Charles Jenkins,5,i like the app ive only had it a couple day but it is better than doing survey,2026-03-12 20:00:07,0,ali-express_reviews,unknown
Falodun Akinwale,4,nice apphas very good and genuine product vendor are good,2026-03-12 19:48:10,0,ali-express_reviews,unknown
e G,1,imma have to give this one star only because of it false advertisement on the pricing,2026-03-12 19:22:18,0,ali-express_reviews,unknown
Dash Mxt,1,if youre in need of the product very quickly you may get a heart attack coz they take forever and you may even forget and think it a scam,2026-03-12 19:19:55,0,ali-express_reviews,unknown
Honor Ao,1,the item i ordered never arrived i also reorder still nothing waste of moneyon this apk,2026-03-12 18:57:06,0,ali-express_reviews,unknown
Michael Ward,1,ive tried contacting aliexpress on numerous occasion with no replyi ordered an item in january and order still not arrived checked tracker saying shipment cancelled but have no explanation into when it will arrive lost patience with themwhy cant i have some communication,2026-03-12 18:54:50,0,ali-express_reviews,unknown
Nyanda,2,these people are scammer if you buy something that come in bulk or that is more than one like the turquoise ring that come in more than one size a mix that come in 2030pcs that i have not received they dont show up mysteriously and they blame you and the carrier but item that were bought that is single item or set oh those show up fine no problem then they dont want to refund you back anything these are not honest or godly people it a facade to sale their product,2026-03-12 18:47:06,1,ali-express_reviews,unknown
Karl Carroll,3,why do i need this app to track my package why cant i do it online through a browser exactly,2026-03-12 18:00:39,0,ali-express_reviews,unknown
Cynthia Butler,3,ad said pick 3 free item i picked them then they said it would cost me 800 to recieve them how is that freefalse advertising,2026-03-12 17:20:41,0,ali-express_reviews,unknown
GIZMO SATANICO,1,i can not sign in 10003 server or network error,2026-03-12 16:56:00,0,ali-express_reviews,unknown
Rahl Gadu,5,למה זה לא מוריד לי ניסיתי אד 24 שאות אפילו יתמול,2026-03-12 16:48:37,0,ali-express_reviews,unknown
Zelda Hulley,1,funny how the discount is removed a soon a you need to pay,2026-03-12 14:39:26,0,ali-express_reviews,unknown
Sara Oliver,5,easy shopping with fun innovative broad selection,2026-03-12 14:36:42,0,ali-express_reviews,unknown
Candy Biehle,1,never got my stuff i paid for my watch daughter jerrika kid cup or cap for her head pissed off please fix the problem,2026-03-12 14:12:58,0,ali-express_reviews,unknown
Joni Shkembi,1,very high price a if they are selling diamond,2026-03-12 13:05:50,0,ali-express_reviews,unknown
Jagger Norden,2,price are good but i hate that choice thing almost everything is a choice i want to buy one thing not three please remove this aliexpress,2026-03-12 13:02:02,1,ali-express_reviews,unknown
Jesson,1,brought faulty item refused credit or refund unable to submit video or picture due to their site not accepting the file even though format wa correct uninstalling over a mere 12,2026-03-12 12:23:59,0,ali-express_reviews,unknown
Jamie Harris,1,when i unsubscribe from certain notification category i still receive notification for those category this practice is unlawful,2026-03-12 10:41:23,0,ali-express_reviews,unknown
Michael K,1,aliexpress ha reached a new low not only did they fail to deliver a combined shipment of multiple item but they also provided false tracking information to paypal to block a legitimate refund the support is nonexistent and the buyer protection is a complete fabrication i am now escalating this a a fraudulent transaction through my credit card company to force a chargeback do not trust this platform with your money they will lie to payment processor to avoid taking responsibility,2026-03-12 10:28:27,1,ali-express_reviews,unknown
rrockstaarr,1,terrible app havnt received my order and it been well over a month no refund they keep replying that someone will get back to me within 2448 hour so i message every three day and still the same response do not buy from here,2026-03-12 10:18:33,1,ali-express_reviews,unknown
Cynthia Swartout,1,it just not for me i unsubscribed and i still get email from them i am not interested in this company and dont know why i still get email from them when i unsubscribed i wish they would stop sending me email please and thank you,2026-03-12 09:46:43,0,ali-express_reviews,unknown
John Ogba,1,very bad experience i bought a fake and damaged glass no compensation i just wasted my 3299 for nothing i did not use the video camera glass twice it stopped charging and all of a sudden the glass pulled out from the lens i am so disappointed that your customer service said they can not do anything that mean i should dispose the glass and lose my money i will continue to give you bad feedback if nothing is done,2026-03-12 09:40:26,0,ali-express_reviews,unknown
Martin Gray,1,tried this and ordered a few thing through one of their offer the package arrived with yodel left on my doorstep for hour finally got home and opened it and half the item are missing and the customer support is unable to figure out i want a refund or the item replacing keep trying to blame courier edit went through the horrendous refund process where you have to raise a refund per item missing all got rejected a i have no proof from the courier and didnt video the opening crazy,2026-03-12 09:22:16,1,ali-express_reviews,unknown
Hans Ko,1,site that dispose off factory defect at attractive price a well a advertised for one thing and shipped you another customer service for return refund are a nightmare a many here have already stated dont fall for this scam site,2026-03-12 09:12:24,1,ali-express_reviews,unknown
Arminas Matulevicius,5,i couldnt say anything bad is like amazon but cheaper a lot cheaper and u get prize,2026-03-12 08:39:04,0,ali-express_reviews,unknown
Gary Shaw,3,it ok to play game and shop really not for me,2026-03-12 08:08:25,0,ali-express_reviews,unknown
Thomas Arthur,5,amazed,2026-03-12 07:25:11,0,ali-express_reviews,unknown
See Ro,5,lapp è meravigliosa ma vogliamo di nuovo per i nuovi utenti lofferta del 099 oppure 3 articoli con 3 di disconto,2026-03-12 07:21:47,0,ali-express_reviews,unknown
Senzo blessing Cele,5,yes i will pay,2026-03-12 06:20:22,0,ali-express_reviews,unknown
Zachary Hernandez,1,signed up for an account and instantly got my account locked before i could even make my first purchase when i appealed they still didnt tell me why my account wa locked waste of my time,2026-03-12 05:26:23,0,ali-express_reviews,unknown
Paris Tunc,1,crime gang,2026-03-12 04:52:53,0,ali-express_reviews,unknown
Paris Tunc,1,there r seller send me a scam 2kg battery instead of 20kg and 160 they charged me after 2 week they make me still stuck to in limbo and i read all review and he is a well known con artist a many people had same l so this is a criminal minded company for not cancelling those fraud reveryday multiple time and they did nothing a i warned them to put bank into case to give a total black list for that brand and they didnt listen and i got email that they are paying me and they willpenalise,2026-03-12 04:45:50,0,ali-express_reviews,unknown
Emily Coleman,5,everything is so cheap and easy to order and receive it on time and it always good product,2026-03-12 01:45:45,0,ali-express_reviews,unknown
Ankur Jain,1,in simple word pathetic experience with aliexpress all the best whoever using their portal,2026-03-12 01:40:07,0,ali-express_reviews,unknown
ПСИХОПАТИНА,1,lie at every turn,2026-03-12 01:37:03,0,ali-express_reviews,unknown
Eyo Peter,3,if you are ordering from nigeria just know that it a one way trip if item is damaged you wont be able to return it ive lost serious money because of this almost 100k after one of the seller sent me a amoled display that doesnt work the platform doesnt have a realistic return logistics for nigeria like temu so if you can take the risk then go ahead,2026-03-12 01:16:13,1,ali-express_reviews,unknown
Leashanta Chism,1,i wish i could give it a minus i had a package stolen even have a police report and couldnt get a refund,2026-03-12 01:02:10,0,ali-express_reviews,unknown
Ruth Mawson,1,my account is locked ive never used aliexpress download this again same thing youre account is locked tried to sign in wouldnt have email phone number first of all no uk code suddenly im on the aliexpress site go to look at something please sign in with your phone number please enter a valid phone number i enter it again this time with the uk code in front please enter a valid phone number never again uninstalling,2026-03-12 00:58:13,2,ali-express_reviews,unknown
Scott Conder,1,seller photo and description are misleading price have gotten too high seller have raised price by 500 on most item not worth it the search algorithm is garbage aliexpress need to govern the seller action better i waste too much time looking for what i want i get frustrated and go to ebay instead,2026-03-12 00:27:03,4,ali-express_reviews,unknown
Mr Smith,1,ha stopped accepting my debitcredit card,2026-03-12 00:05:51,0,ali-express_reviews,unknown
Faith McLean,5,i love aliexpress theyre so much better than another online place where you can buy stuff you can buy something for 2 off of here you dont have to spend 20 like you do on the other website so far i have not been disappointed on anything i bought from them and i have bought a lot of stuff and just a month and a half ive bought over 100 item if not more,2026-03-11 23:58:23,0,ali-express_reviews,unknown
Christopher Atkin,5,i thought this wa going to be like wish or temu where they make these wild claim of free stuff or discount under a buck the weirdest thing happened though they were telling the truth now they arent making extravagant claim like the others but the one they are making they honor them i have my whole family ordering from them long shipping time are the only downside not even enough to knock a star off because they tell you in advance how long it will take,2026-03-11 23:56:47,0,ali-express_reviews,unknown
Lio B10,1,3 package never received arrived to wrong city no one answered 4 mail sent back no refund now aliexpress take no responsibility never again order with them,2026-03-11 21:57:21,0,ali-express_reviews,unknown
Adina L,5,there are many item to see from different vendor be sure to read product review and use common sense you can find great item and if thing do not work out like expected the customer service is there to help and is amazing,2026-03-11 21:55:53,1,ali-express_reviews,unknown
Marcie Graham,1,never got my stuff they lied about the mailing source dont trust them i lost out on my money too temu is better,2026-03-11 21:53:27,0,ali-express_reviews,unknown
Dontae Hufflin,5,awesome service never have had a single issue they send what is advertised every single time and you cant beat their price or their product temu wish have nothing on aliexpress,2026-03-11 21:14:59,0,ali-express_reviews,unknown
Jo Carbonell,1,i orrderd window tint and that wa two week ago still nothing guess the delivery person wanted the package more or they just decided not to fill the order and keep the moneywhy you think thing are cheap on advertisingthey keep your money,2026-03-11 17:23:22,0,ali-express_reviews,unknown
Ammar M.Ahmad,5,very nice app,2026-03-11 16:56:04,0,ali-express_reviews,unknown
Bridgette Schram,1,horrible business avoid at all cost i wa missing an item from my order and they refused a refund asked me to prove that i never received it use temu faster shipping reliable and excellent customer service,2026-03-11 16:39:01,1,ali-express_reviews,unknown
Nicole Trammell,5,fun,2026-03-11 15:29:00,0,ali-express_reviews,unknown
tjan putri,1,honestly i havent experience the app because i couldnt use it i live in indonesia and i downloaded this shopping app because i saw cute bag in this app but when i oppened it you need to choose the country or region where you live right so i searched for my country indonesia but i only saw my neighbouring country malaysia so i couldnt experience the full shopping experience i hope you could add indonesia to you app please,2026-03-11 15:12:44,1,ali-express_reviews,unknown
Matas Matas,5,this is the good app im not going to lie i found garbage item that could explode easily,2026-03-11 13:54:08,0,ali-express_reviews,unknown
D Bier,1,absolute garbage i dint suggest this app a when you make a purchase over 50 and it stolen you lose your money time and sanity there is no customer service and there even less in these low quality item i tried to get a refund for stolen package 5 time they said prove it how doe one do that how can i prove that i shook a person hand i just met app is stupid and pointless go to temu,2026-03-11 13:52:46,0,ali-express_reviews,unknown
CATCH22,3,seller are polite and helpful but some use chat bot that when an item is not sent you cant get a satisfactory answer,2026-03-11 13:23:47,1,ali-express_reviews,unknown
J,5,it s really good app and all the product come in good shape and it ha affordable price,2026-03-11 12:05:12,0,ali-express_reviews,unknown
Sara J,1,no where to register for an account,2026-03-11 11:22:59,0,ali-express_reviews,unknown
Coems,1,ordered a charger waited for 10 day when it arrived at my county the order wa unsucesfull,2026-03-11 08:54:13,1,ali-express_reviews,unknown
Benjamin Brewer,4,i like this app very good,2026-03-11 08:53:13,0,ali-express_reviews,unknown
Jaco van As,1,i wa hesitant from the start and should have trusted my gut aliexpress is a scam you wait for ever to get your product and then they robbed you by not giving it the way you ordered when you complain they put it on you to provide solid proof the you do that and they say it still not enough proof i just lost money what a scam will be reporting this to play store a well,2026-03-11 08:42:40,1,ali-express_reviews,unknown
philip paranthoiene,4,nb i never give 5 star for anything so 4 star is a maximum i had an issue with a delivery got to my country then disappearedali express were prompt and courteous to deal with it i wa eventually refunded the full amount i have now purchased the same item again,2026-03-11 08:06:57,0,ali-express_reviews,unknown
Alex,1,i can not buy from their shop it doesnt allow me to use my real name their customer service even email is ai and go in circle if they dont want me to buy fine thats on them,2026-03-11 07:43:39,1,ali-express_reviews,unknown
Alex likes dogs,1,very slowit show gross image no matter what you look upthings like infection or sexual image if an item say delivered and you didnt get it you dont get a refund the page refreshes every time i try to get one so i just cant also ha thing like swastika and l0li the customer service doesnt help and you have to take 50 picture of each item to return it even if you didnt get the item literally no way to get refund do not install,2026-03-11 06:46:07,12,ali-express_reviews,unknown
Ronnie,1,full of scammer constantly spamming email and push notification dog,2026-03-11 04:56:46,1,ali-express_reviews,unknown
Ethel Reid,1,it not letting me pick what i want,2026-03-11 04:43:07,0,ali-express_reviews,unknown
Kimberly Dumas,1,this sell your credit card number,2026-03-11 04:25:58,0,ali-express_reviews,unknown
Tammy Skifstad,5,useful,2026-03-11 03:40:25,0,ali-express_reviews,unknown
Craig Maybury,1,the app is crashing constantly now i cant acess the play and earm area at all,2026-03-11 02:53:35,0,ali-express_reviews,unknown
King Cardigan,4,terrible experience on a z fold all my other samsung device this app is cool but on the fold it well all i will say is that it confusing it so confusing i can not describe it except it look like there are two aliexpress apps running side by side and you dont know which one to use so annoying,2026-03-11 02:26:43,0,ali-express_reviews,unknown
Rob G,1,terrible customer service impossible to get your money back when a faulty product is shipped,2026-03-11 02:20:19,1,ali-express_reviews,unknown
Dirty South 316,1,absolute jokedo not use this website absolute joke,2026-03-11 00:23:02,1,ali-express_reviews,unknown
Hassan Jones,1,they did not deliver my package when i asked for a refund or for a replacement i wa ignored and never received anything back regarding the situation,2026-03-10 23:58:35,1,ali-express_reviews,unknown
Kevin Mcmahon,4,excellent,2026-03-10 23:47:10,0,ali-express_reviews,unknown
Matt Schellhaas,5,i lalalaley try aliexpress before and thery are not freaking scammer trust me aliexpress it good,2026-03-10 23:33:59,0,ali-express_reviews,unknown
Ti to,5,شكرا لجهودكم,2026-03-10 23:33:12,0,ali-express_reviews,unknown
Eric Laforge,1,i always get scammed they always find a way,2026-03-10 23:15:15,198,ali-express_reviews,unknown
Zack,1,signed up and it instantly started spamming me uninstalled,2026-03-10 21:40:26,1,ali-express_reviews,unknown
Promise Abumere,1,i wa scammed by aliexpress seller accept to do a partial refund for a defective item yet aliexpress refused to no refund and complete the lcd screen i purchase the fame doesnt fit pouch and doesnt touch well i followed all the instruction when fix it but it not the case i am complaining about the overheating and the frame side the heat sink on the frame is small unlike the original screen some part doe not touch i try another screen different from the screen i order it worked,2026-03-10 20:18:45,1,ali-express_reviews,unknown
Sonia Ikie,1,awful scammer my transaction history is lost after paying for good,2026-03-10 19:19:07,1,ali-express_reviews,unknown
Atif Ahmed,5,good,2026-03-10 17:21:46,0,ali-express_reviews,unknown
Mike M,2,advertising one thing but sending another still waiting for their customer service to get back to me on my order,2026-03-10 16:17:36,1,ali-express_reviews,unknown
Keno Ken,1,worst customer service in the world they keep repeating the same answer over and over again ignoring the customer completely they also allow so many counterfeit and fraudulent item like 2tb thumb drive for 5 they dont only refuse to take obvious scam down they seem to encourage them zero care for their user,2026-03-10 15:46:49,1,ali-express_reviews,unknown
Enrique El Sato de Hato Rey,2,i prefer the website the app is buggy and doesnt offer much,2026-03-10 13:31:02,1,ali-express_reviews,unknown
GTepanator,1,app kept sending me here one star for my trouble,2026-03-10 12:59:45,1,ali-express_reviews,unknown
Evarest Natse,1,ali express are the worst ive been following up on a refund for 4 month and till today i have never gotten my money back the app is full of scammer who just want your money dont buy anything from ali express again,2026-03-10 12:19:25,1,ali-express_reviews,unknown
Patryk,4,na stronie z punktami pokazują się losowe zniżki których nie da się uzyskać mocno utrudnia to zakupy edit okazało się że procentowa zniżka obok produktu uwzględnia też kupon zniżkowy a nie tylko punkty nadal uważam że nie powinno tak być bo jest ikona punktu obok zniżki,2026-03-10 12:11:14,0,ali-express_reviews,unknown
Phil,1,i am trying to get a simple refund for something that is clearly not going to be delivered and i ordered a long time ago instead of simply refunding my money which is less than 3 i am getting a big runaround by stupid little bot they will not refund my money or at least i think they wont by the time im finished with aliexpress theyre going to wish they had refunded it,2026-03-10 11:37:23,1,ali-express_reviews,unknown
Russell Perkins,1,disgusting treatment false advertising a pair of product that were sold but never recieved claiming it wa only one of the item when ive got evidence from advert and order receipt delayed delayed delayed now im still fighting for a refund 2 month down the line never been treated like this by a company and their seller watch out for navrider seller total scam ali express are enabling many like them and withholding my refund after admission of negligence,2026-03-10 10:50:39,1,ali-express_reviews,unknown
Anthoz Duppiez,4,i love this app,2026-03-10 09:31:45,0,ali-express_reviews,unknown
Kyri J,1,a a long term loyal customer it is clear that seller and aliexpress work together against their customer when problem arisemisleading advert documented verbal abuse from seller when legitimately complaining aliexpress really doe not care to act even after appealswhen you order something your probability of success in return is very low if there is a problem shipping is often not coveredcontact support so we can help is an automated waste of time and endless loop,2026-03-10 09:12:56,1,ali-express_reviews,unknown
Misty Vanhorn,5,fast delivery good price on most the item product look good,2026-03-10 07:58:37,0,ali-express_reviews,unknown
Johan Spruyt,1,i do not recommend aliexpress ordered item never received after tracking it appears the item wa never sent no item and no refund they say item is in local custom yet when contacting custom they find nothing under the supplied tracking number shop on own risk,2026-03-10 06:37:24,1,ali-express_reviews,unknown
Xzaevory Gonzalez,3,,2026-03-10 06:16:52,1,ali-express_reviews,unknown
David GIlmore,5,excellent,2026-03-10 06:11:11,0,ali-express_reviews,unknown
Angela Stern,1,garbage no comment,2026-03-10 06:11:01,1,ali-express_reviews,unknown
S LMK,1,really sick of the constant pop ups and ad just let me purchase in peace ffs unable to turn off constant promotional message from store which flood your message center until it impossible to find important message the user experience could not possibly be more frustrating i do not want to play a stupid mobile game for coin absolute masterclass in userhostile hateful design,2026-03-10 05:43:29,3,ali-express_reviews,unknown
Tia Cummings,5,great app love it,2026-03-10 04:53:59,0,ali-express_reviews,unknown
Katelyn Selvaggio,2,i bought a pair of earbuds but the charger wa completely broken and they dont work i also bought other stuff and they arrived broken and unusable,2026-03-10 02:58:21,2,ali-express_reviews,unknown
Holly Benitez,5,i purchased a set of ear bud for99 and ive been so happy with them now im going to try to make another purchase for another great item,2026-03-10 02:35:23,0,ali-express_reviews,unknown
Kinsley,5,i love it,2026-03-10 01:40:24,0,ali-express_reviews,unknown
Meyola chudasama,1,i order stuff a a 1st time customer and never received them i tried to get a refund it wa also impossible a well i will never use this app to shop again,2026-03-10 01:16:48,1,ali-express_reviews,unknown
Michael M,1,horrible app and customer service,2026-03-10 01:08:04,1,ali-express_reviews,unknown
Gerri Cooper,1,ive had enough of purchasing thing and then having the item come totally different from what i purchased or not coming at all and then i get a refund without even let me know that it not coming im not shopping with them anymore the seller are crook false advertising and just straight up not a good platform to buy thing from i give it one star because there no less than one,2026-03-10 00:51:45,1,ali-express_reviews,unknown
Angie,1,their price are not honest if you add to cart and select the shipping their price will become higher be careful this is dishonest marketing they tell you one cheap price then upcharge once you are about to purchase the item,2026-03-09 23:47:09,1,ali-express_reviews,unknown
Benjamin Van Dermark,1,all 3 of the item from my welcome gift get 3 but only pay for 1 got canceled on me after being very late now i dont get thing i ordered and lost out on the welcome deal,2026-03-09 23:32:33,1,ali-express_reviews,unknown
trish Pyles,1,did not load,2026-03-09 23:21:46,1,ali-express_reviews,unknown
--,1,im not registered with a google email address why are you are forcing me to do it you useless npc i cant sign in anymore cant write my email address because aliexpress is reading my google play email you are violating gdpr,2026-03-09 22:52:26,1,ali-express_reviews,unknown
Mark -,1,i cant upload video to the app when requesting a refund,2026-03-09 21:28:32,1,ali-express_reviews,unknown
