userName,score,content,at,thumbsUpCount,source,app
Ryan LaFebre,1,i guess amazon no longer us any sort of padding or box my last 3 order came banged up with damaged packing because they were all sent in thin plastic envelope,2026-03-08 17:58:53,1,amzon_reviews,unknown
Carlos Febrer Rosello,4,awesome,2026-03-08 17:57:49,0,amzon_reviews,unknown
J B,1,what is the point of overnight delivery if it doesnt show up on time thanks for nothing i dont know if anyone else ha noticed how the service quality is flat lining,2026-03-08 17:52:46,1,amzon_reviews,unknown
Bonnie Festing,5,picking up melware,2026-03-08 17:51:27,0,amzon_reviews,unknown
Teresa Crawford,5,i am a amazon fan i shop amazon all the time i dont have a car and i honestly dont like crowd so amazon it is i get great deal and free shipping the subscription service are perfect carrying cat litter from the store isnt fun and amazon brings it to my door if something isnt right the return is easy and never a problem if you dont use amazon you really need to,2026-03-08 17:33:37,0,amzon_reviews,unknown
Betsy Adamo,1,great difficulty using n celllphone,2026-03-08 17:03:48,1,amzon_reviews,unknown
Dani Kong,1,turned off notification in december for the holiday after turning the notification back on no shipping notification are coming through on my phone this basically kill my desire to order through amazon because i dont get shipping update i contacted support and it wa absolutely useless there is an old reddit thread with this same problem it seems to be a bug fix it,2026-03-08 16:06:04,2,amzon_reviews,unknown
Robinette Brown,1,negative 1 million to the fullest it funny how amazon ha supervisor and manager that can not resolve issue but can only take feedback to me thats a waste of money and they should be eliminated i have tried over and over to resolve my account issue with this dysfunctional organization and have gotten nowhere i have contacted the right organization that will help me with this issue and best believe i will never returnsuggest anyone to shop with these horrible people and organization,2026-03-08 16:03:24,0,amzon_reviews,unknown
Anthony Wakefield,1,the app wa great until the latest update caused a bug my app wont even open now it close right after opening and say there is a bug and to try again later,2026-03-08 15:53:14,1,amzon_reviews,unknown
Pieter Smith,5,love the ease of shopping without leaving my house quality is guaranteed by amazon never had a problem that wa not fixed,2026-03-08 15:38:59,0,amzon_reviews,unknown
Ivy Muyambo,1,i really really love the app but it led me install it on my phoneitll install the other appsi mean on other phone,2026-03-08 15:30:23,0,amzon_reviews,unknown
Kingston Papa,5,i hope to enjoy buying on amazon,2026-03-08 15:16:37,0,amzon_reviews,unknown
Stu Fortunato,5,you cant beat amazon,2026-03-08 15:07:00,0,amzon_reviews,unknown
Dirk Birch,5,when i order stuff from amazon it say my package are on the way and all of my package arrive on the delivery day a few of my package are still on the way and so i always track them when they changed day for delivery i love amazon app,2026-03-08 13:42:17,0,amzon_reviews,unknown
Nuno Gomes,1,no tablet support this is just bizarre,2026-03-08 13:21:06,0,amzon_reviews,unknown
Remigijus Bindokas,5,,2026-03-08 12:37:45,0,amzon_reviews,unknown
Shonda C.,1,how doe the number 1 ecommerce shopping site not have dark mode that bright light is obnoxious to most people these day come on amazon get with the program 5 year later still no dark mode i cant believe it these company dont stop to think about people with vision issue or light sensitivity do they,2026-03-08 12:26:05,1,amzon_reviews,unknown
Joseph DeAngelis,5,i love you amazon thank you for delivering my package 4 day early,2026-03-08 12:10:47,0,amzon_reviews,unknown
Lisandra Castillo,1,im gon na be leaving review in every place where amazones is so they cant forget me anymore amazon solía ser rapidez eficafia y customer service support ahora e simplemente otro lugar más donde comprar carísimo y para colmo no respetan los tiempos de entrega no hay atencion al cliente y ni siquiera se ponen en contacto con uno para decirle mire esto está pasando con su entrega e una falta de respeto que no respeten la garantía de entrega,2026-03-08 11:59:23,0,amzon_reviews,unknown
Loki Moon,2,i would like this app other than there a so many issue almost everything is ai i wonder a package and specific typed in where i wanted it delivered and it delivered the package to my old address where the new owner took the package and i never got it not to mention it so hard to navigate this app once i found out i tried to chance the address and then it wouldnt confirm unless i typed in what card im using and confirm it you dont need access to my money to confirm my address,2026-03-08 11:47:38,1,amzon_reviews,unknown
Mohammed Mahbood,1,worst app dont use it worst customer support worst delivery timing delivery delayed for 3 day customer support daily mentioning today evening or tomorrow morning daily same repeat use any local provider that will be good,2026-03-08 11:47:13,0,amzon_reviews,unknown
roger whittle,4,easy to use,2026-03-08 11:24:55,0,amzon_reviews,unknown
Dave,2,the add to delivery system doesnt work properly if you add something to an already set order to arrive with it there are chance that it just wont come that day but if you separately order it and it can be delivered the same day it will come no problem,2026-03-08 11:00:17,0,amzon_reviews,unknown
Riyaadh Sadek,3,layout of the app could be improved,2026-03-08 10:10:06,0,amzon_reviews,unknown
Libumon valleriyan gyallo Gyallo,5,,2026-03-08 09:41:16,0,amzon_reviews,unknown
Sweta Tamrakar,1,can not buy from nepal,2026-03-08 09:17:46,0,amzon_reviews,unknown
Burkuagh,1,this used to be a good app until amazon decided to hide all the review except 8 out of the thousand that they have curated for you to see so you cant see a single bad review,2026-03-08 08:50:14,1,amzon_reviews,unknown
Glendita SantGracia,5,i love amazon,2026-03-08 08:02:48,0,amzon_reviews,unknown
Brian,1,omg,2026-03-08 07:50:08,10,amzon_reviews,unknown
Mahanta Mohapatra,5,good,2026-03-08 07:24:02,0,amzon_reviews,unknown
Michelle Butler,5,so quick and easy,2026-03-08 07:13:35,0,amzon_reviews,unknown
Joseph Stanley,2,march 7 2026 update im not here to review prime or other amazon service a this is a listing for the app thats all that should be reviewed and it gotten horrible frequent crash unstable navigation and one of the slowest apps that i use i cant even switch between the various product offered on a single listing without having to wait 6090 second for it to load cant even scroll when this happens you want people to spend then make it a usable app ffs,2026-03-08 06:50:58,790,amzon_reviews,unknown
Arik Braslavsky,1,horrible do yourself a favor and dont use amazon awful service i ordered an item they make me wait for it for a month with a gurantee for it to come before a date then two day before the date they have to deliver it they send it back to seller and telling me it broken and then i order it again it dont come and they hust say oh were sorry do a refund like it ok them i ordered another one ive waited over a month and it didnt even get to custom not using it ever again,2026-03-08 06:34:12,0,amzon_reviews,unknown
Hugo Zuniga,1,i can not get into amazon in my tablet,2026-03-08 06:24:46,0,amzon_reviews,unknown
Heath Fleming,1,crash all the time cant do anything,2026-03-08 06:24:02,1,amzon_reviews,unknown
Virginia Gutierrez,5,great shopping and great price,2026-03-08 06:21:03,0,amzon_reviews,unknown
Zawad Rahman Mutasim,5,good,2026-03-08 06:20:58,0,amzon_reviews,unknown
Jason Keintz,1,no longer compatible for samsung tablet,2026-03-08 05:55:06,0,amzon_reviews,unknown
James Parker,5,i love shopping on amazon because everything is so easy and you get your order fast,2026-03-08 04:54:26,0,amzon_reviews,unknown
Pro Bioz,5,this all product is clean and real or not damaged highly recommended,2026-03-08 04:17:27,0,amzon_reviews,unknown
nathan eubank,2,package are always late they promise next day or same day and cant deliver it never used to be this way but in the last month i have had 4 shipment be late or lost will look for somewhere else to shop,2026-03-08 04:04:36,0,amzon_reviews,unknown
Lynn Serenity,5,trusted an true my go to for thing i need,2026-03-08 03:14:32,0,amzon_reviews,unknown
Donnie Barksdale,5,amazon is our life and world now love it,2026-03-08 02:58:44,0,amzon_reviews,unknown
Douglas Smithing,5,great app amazon shopping,2026-03-08 02:54:10,0,amzon_reviews,unknown
RJS,5,easy fast,2026-03-08 02:38:08,0,amzon_reviews,unknown
John Kim,1,the app is fine but like others have stated oneday delivery take multiple day it happening more often something i ordered recently wa a nextday delivery but kept getting delayed and i had to eventually cancel a phone case i ordered yesterday wa supposed to come today march 7th but is now showing march 10th i have had multiple item come late what is going on with your logistics oneday shipping is the main reason i pay for a prime membership,2026-03-08 02:22:24,1,amzon_reviews,unknown
Sheila Jones,3,a of today my amazon app is still freezing while im looking at any item i clear the cache and force stop let it set then restart the app and click on a saved item to see a different color or size then my amazon app freeze yet again i have updated this app but having the same issue i dont want to uninstall and download it again for fear i will loose everything how can this be fixed,2026-03-08 01:41:53,2,amzon_reviews,unknown
Downward Alpha,1,package are never on time even after paying the 13 dollar a month for prime they always arrive 2 day to even a week later than what the app say,2026-03-08 01:40:55,0,amzon_reviews,unknown
Rah,1,app required me to scan my card on the back of my phone and it took too long cuz i had to remove my case military grade metal with 6 screw holding it together app said order on hold and to update payment lie order canceled which i found out after calling amazon it wouldnt be a big deal if i could add the canceled item to my cart from my history but nope cant do that have to waste even more time searching for all the item in my order one by one fix your app amazon,2026-03-08 01:37:10,1,amzon_reviews,unknown
Ella Smith,1,prime mean nothing now every purchase come like 4 day late if it come at all have had a lot of package not even show up,2026-03-08 01:19:42,0,amzon_reviews,unknown
Nima Khalighi,1,year of constant loading issue for the profile order page through various different phone or internet the issue ha never been fixed the devs have been a disgusting failure to amazon app it so unreliable that you sometimes have to go through the website instead absolutely unacceptable quality coming from amazon their server have been knowingly full of issue for year still not fixed,2026-03-08 01:18:12,2,amzon_reviews,unknown
Rose,5,love it lot of option and easy ordering,2026-03-08 00:48:13,0,amzon_reviews,unknown
Dark King35,4,so far every order i want came a expected,2026-03-08 00:44:50,0,amzon_reviews,unknown
Shaun Lassiter,5,great selection at a great price the app changed how order are viewed and i dont like it,2026-03-08 00:26:39,0,amzon_reviews,unknown
Damian,3,please add dark mode,2026-03-08 00:14:20,1,amzon_reviews,unknown
Devin Caulfield,5,awesome 4 shopping,2026-03-08 00:04:58,0,amzon_reviews,unknown
debbie diblasi,5,very good,2026-03-08 00:01:06,0,amzon_reviews,unknown
Daniel Cichosz,5,this is the best shopping have you ever used before everyone download amazon and shop,2026-03-07 23:56:40,0,amzon_reviews,unknown
Diane Davis,5,i enjoy shopping on amazon i find some good price also they also have a good selection,2026-03-07 23:45:11,0,amzon_reviews,unknown
Akhtar khan,5,very bad experience i tried many time to create an amazon account from pakistan but the otp verification code is never sent to my phone number my number is correct and work with other apps but amazon doe not send the code at all because of this i can not complete the registration process it is disappointing that such a big platform can not handle a simple otp verification for user in pakistan please fix this issue,2026-03-07 23:35:11,0,amzon_reviews,unknown
Sharon perryman,5,i received some cooking utensil from my friend a a welcome home gift there the best,2026-03-07 23:00:43,0,amzon_reviews,unknown
marib0214,4,worker need to deliver to right address,2026-03-07 23:00:28,0,amzon_reviews,unknown
dan todaro,2,the app had progressively gotten worse over the year,2026-03-07 22:50:00,0,amzon_reviews,unknown
Muhammad Salman,1,cant create account in pakistan not getting otp on my phone number tried too many time waited hour but nothing work,2026-03-07 22:41:34,0,amzon_reviews,unknown
Anthony,5,amazon make shopping so easy and so sufficient i love it,2026-03-07 22:41:33,0,amzon_reviews,unknown
Logan K,1,completely locked me out from the app because i have a tablet it 2026 figure your stuff out,2026-03-07 22:06:49,0,amzon_reviews,unknown
Linda Walton,5,mine is very exciting and rewarding more in the futuretap on a clip to paste it in the text box by,2026-03-07 22:02:14,0,amzon_reviews,unknown
jason white,5,purely brilliant,2026-03-07 21:46:55,0,amzon_reviews,unknown
Wilbert Peter,1,service suck and they take your money but you have to contact third party seller when they dont deliver amazon is becoming a scammer paradise if i do a transaction with you it your responsibility to handle the issue pathetic 5050 chance youll get what you pay for and service is horrible service got worse they deliver nothing on time anymore this what happens when business get rich they stray away from what made them amazon just another big business without value anymore,2026-03-07 21:44:03,1,amzon_reviews,unknown
Adriana,5,awesome done just awesome i love this because the thing you can access in the app,2026-03-07 21:18:05,0,amzon_reviews,unknown
James Denison,2,always late every time i order something that is prime and promised 2 day delivery always late can never keep there promise,2026-03-07 21:14:30,0,amzon_reviews,unknown
Madonna Cranford,4,it wa okay,2026-03-07 21:03:51,0,amzon_reviews,unknown
2amSpeedMerchant,5,i always get what i need from amazon never a problem with item or delivery an easy 5 star,2026-03-07 20:57:07,0,amzon_reviews,unknown
Hillbilly Redneck,1,90 of order placed with amazon i get notification that say out for delivery yet it doesnt arrive your next message is unknown delivery date dont subscribe to amazon amazon is no longer what it used to be definitely paying amazon for your subscription for prime isnt worth it non prime and prime member mean the same thing amazon prime failed again every single one of my order there been a problem so today this order i had to finally cancel it and have it sent back,2026-03-07 20:47:21,10,amzon_reviews,unknown
Rishi P,4,it good,2026-03-07 20:45:39,0,amzon_reviews,unknown
C,1,work fine but no dark mode the is no way to make the amazon app ui less white and bright amazon even prevents forced dark mode via android i cant believe they dont have a dark mode in 2026,2026-03-07 20:38:34,1,amzon_reviews,unknown
Mr and miss Whitcher,5,good,2026-03-07 20:33:02,0,amzon_reviews,unknown
KorHDD Re;Birth,1,amazon is slow and bad because you have to wait for many day for your order to be shipped ebay is better and faster because your order will be shipped on the same day you purchased the item or it will be shipped on the next day,2026-03-07 20:26:06,0,amzon_reviews,unknown
Kathy S,2,add to list option isnt working it hit or miss it very frustrating when youre trying to add something to an existing list,2026-03-07 20:13:38,0,amzon_reviews,unknown
M Mohamed,5,this app ha every application you wish for,2026-03-07 20:03:55,0,amzon_reviews,unknown
Taylor Burgin,2,a handy a amazon is the app is terrible about showing you item you are attempting to filter out when i search 100 cotton insert any clothing item the first item are always rayon or some other blendsemi or full synthetic material even with filtering material it still will not show what you are looking for what is the point of having a filter if it doe not filter,2026-03-07 19:56:22,0,amzon_reviews,unknown
Squirel ThatNigg,5,even before becoming an affiliated employee of amazon it had been my all time go to app for so many year i can not count i am new to the affiliate program and have yet to utilize it properly so to comment on that would be unjust i can say the opportunity appears to be there to monetize grately with all other aspect associated with social medium included of course i love amazon because there all type of different program to choice to apply for with amazon,2026-03-07 19:45:30,0,amzon_reviews,unknown
Otis Walker,5,amazon is very useful i love being a prime member because i can get item within a one day or two day delivery,2026-03-07 19:43:13,0,amzon_reviews,unknown
Sydney Williams,2,great normally that stop when trying to verify age useless,2026-03-07 19:33:59,0,amzon_reviews,unknown
Paige Hogya,1,the amazon customer service is non existent i keep trying to contact them my kid ha an amazon fire tablet and it play ad every 10 second even after paying to have the ad removed restarted the device still happens contacted customer service at some point and apparently you have to pay to remove ad from the device then pay each of their apps to remove ad a well absolutely ridiculous interrupt everything including going into the tablet setting not just when the game are open,2026-03-07 19:26:31,1,amzon_reviews,unknown
Q Creyton,1,what is wrong with your search stop auto correcting me to something completely different with no option to search for thing exactly a ive written them that dint even make sense not worth the price for prime and too many seller just filling listing with inappropriate keywords without being moderated for search to find anything of any kind of quality,2026-03-07 19:17:48,0,amzon_reviews,unknown
Steve Ott,1,this app is a cluttered mess easier to drive to a store and buy what you need also difficult to return product,2026-03-07 19:06:37,0,amzon_reviews,unknown
Sullivan,2,1st order and they deliver the package to the wrong house then when i find the package at the house and get it i open my package and find the complete wrong item in the parcel,2026-03-07 19:00:36,0,amzon_reviews,unknown
lisa knouse,4,since this update i cant see my list it say page not found please fix it,2026-03-07 18:31:31,4,amzon_reviews,unknown
Fig “Tasty” Newton,1,your ai inclusion ha destroyed the app experience for me item option do not load well at all half the time it freeze the app and just gray out the option and price area while failing to respond yall have absolutely no clue what youre doing huh,2026-03-07 18:28:17,1,amzon_reviews,unknown
Julie Carter,2,i get amazon prime and now my package are not arriving when they say,2026-03-07 18:19:16,0,amzon_reviews,unknown
Deborah Wingo,5,great shopping price and delivery experience,2026-03-07 18:11:55,0,amzon_reviews,unknown
Danielle Satterfield,5,got to love amazon,2026-03-07 18:11:41,0,amzon_reviews,unknown
Ryan Baker,4,you can get anything here just dont expect the delivery date to be very accurate,2026-03-07 18:08:02,0,amzon_reviews,unknown
Zachary McLaughlin (Zack),1,cant use it on tablet,2026-03-07 17:04:52,0,amzon_reviews,unknown
SIPHO MNCUBE,4,excellent,2026-03-07 17:03:08,0,amzon_reviews,unknown
Paul Newman,3,not good not installing,2026-03-07 16:49:29,0,amzon_reviews,unknown
Qassem V Bey,3,كخدمه كويسة جدا و التوصيل كويس جدا انما لو طلبت اوردر و لقيت شركة بوسطه هي الي بتوصل الطلب انت هتعيش اسوا ايام حياتك,2026-03-07 16:48:40,0,amzon_reviews,unknown
Neil Honeybone,1,not available on tablet have used this for year on samsung i had to remove it to get alexa on my speaker and now i cant reinstall a it say not for this device huh,2026-03-07 16:27:58,0,amzon_reviews,unknown
sammy Sosa,1,my wife doesnt have amazon prime so she sends me a link to something she want that show it 26 plus shipping i open the link and it 32 with free shipping scam artist thief how long ha this been going on for can someone please open a lawsuit,2026-03-07 16:13:27,1,amzon_reviews,unknown
Kayleigh Nguyen,5,hey im grateful amazon exists im grateful google exists i do not hate corporation i do have very little money and no personal income i signed up for the free trial for amazon prime through google i wanted to cancel the subscription before i got charged the fee the fee ha already been taken from my paypal account ive been trying to cancel the subscription but there is no option to do that the fee is a monthly reoccurring charge i do not have money to pay for that,2026-03-07 16:12:39,0,amzon_reviews,unknown
Alima Rogers,5,it so easy and convenient,2026-03-07 15:38:50,0,amzon_reviews,unknown
Jean Mitchem,4,almost perfect,2026-03-07 15:35:38,0,amzon_reviews,unknown
George Sloan,1,cant find how to uninstall prime,2026-03-07 15:15:39,0,amzon_reviews,unknown
roguewithasilverpen,1,customer safety mean nothing to this company not surprising given how theyve always treated their employee at amazon the last order my wife placed with amazon wa for bath salt powder and other chemical product in addition to coffee all of which arrived packed loosely together in a single plastic bag with some package partially crushed if any sensible consumer protection law were in place in america amazon would have violated every single one of them,2026-03-07 15:05:37,1,amzon_reviews,unknown
Reo Dewan Smith,5,awesome amazon,2026-03-07 14:54:06,0,amzon_reviews,unknown
Richard Atkins,1,no longer available for tablet dont make any sense,2026-03-07 14:03:59,0,amzon_reviews,unknown
Jay,1,slow laggy bloated delayed pop ups that are easy to click by accident showing subscribe and save price instead of purchase price broken unintuitive menu honestly i could go on and on none of this is related to amazon a a service just this terrible app,2026-03-07 14:02:13,2,amzon_reviews,unknown
Moses Gondwe,5,l dont have much experience but l can do it,2026-03-07 13:48:57,0,amzon_reviews,unknown
Mandi June,2,ive used amazon for year and everything is great until you need to speak a human being you cant email online or ring to talk to anyone if something is bought via 3rd party it very hard to get a refund,2026-03-07 13:42:03,0,amzon_reviews,unknown
Shrina Bhagat,3,chatting to customer service is a nightmare too much ai bot that cant actually help and then you have to go back to the beginning again,2026-03-07 12:31:43,0,amzon_reviews,unknown
Thokozani Hlong,5,exceptional app,2026-03-07 12:22:06,0,amzon_reviews,unknown
Moon,1,the app ha been nonstop closing out and hasnt changed even after being updated,2026-03-07 11:49:38,1,amzon_reviews,unknown
Mary Whitaker,2,unable to update a requested,2026-03-07 11:45:35,1,amzon_reviews,unknown
James Kauzlarich,1,03072026 been using amazon since it wa just an online bookstore for physical book would shop a lot more if you fixed your search properly to serve your customer not your bottom line like you used to havent loved amazon for year ux been getting worse for decade especially alexa 10 year of no progress and back sliding 10242020 review love amazon,2026-03-07 11:44:33,0,amzon_reviews,unknown
A R,3,incredibly glitchy often kicked out in the middle of doing something filter option arbitrary inconsistent certain payment optionsdiscounts such a ebt or credit are not automatically applied ability to add are also hidden esp due to recent payment review interface change which is less user friendly get sick of constant prime advertising ebt discount also hidden had to do a wacky runaround to get it despite calling amazon for it to be fixedwas never fixed,2026-03-07 11:19:49,1,amzon_reviews,unknown
D'Andre,1,please start using amazon whiteblue logo bag on all small item because i never received my item from a amazon driver if it happens again i will press legal charge with amazon,2026-03-07 11:06:27,0,amzon_reviews,unknown
Michael Tom,1,need dark mode year overdue overall clunky ui,2026-03-07 11:03:34,1,amzon_reviews,unknown
Brian Drake,2,the app is glitchy if you choose something and you want to see a different color it take forever to load it also doing it on my tablet which is also telling me that it not compatible with the tablet anymore whats going on,2026-03-07 10:42:31,1,amzon_reviews,unknown
aa Abdo,1,customer service bad,2026-03-07 10:08:41,0,amzon_reviews,unknown
Justin H,1,bad introduction of more anti pattern it take like 10steps to return something now,2026-03-07 08:46:31,0,amzon_reviews,unknown
Ulas Saracoglu,1,zero customer service horrible delivery service driver just dump package anywhere and let you a the customer to deal with it customer service constantly lie and tell you whatever you wan na hear for you to end the conversation amazon no longer provides next day delivery since i have to deal with missing delivery empty box they arent even cheaper same discount are made in brick and mortar store by brand,2026-03-07 08:37:46,0,amzon_reviews,unknown
William Conway,4,good,2026-03-07 07:45:37,0,amzon_reviews,unknown
Carlos Ramos,2,discrepancy between promised and actual delivery date,2026-03-07 07:36:04,0,amzon_reviews,unknown
Mary,1,no help,2026-03-07 06:59:54,0,amzon_reviews,unknown
James Shruga,5,awesome thanks,2026-03-07 06:59:26,0,amzon_reviews,unknown
Nate Tobin,2,very deceptive with their delivery date i understand that unforeseen interruption happen but i am consistently promised a delivery date only to have it changed with zero explanation or even a notification i make plan based on amazon promise but they cant be trusted i have screenshots to back up my review of this terrible business model,2026-03-07 06:35:16,2,amzon_reviews,unknown
