userName,score,content,at,thumbsUpCount,source,app
Merritt Rahn,2,tried to order several item which took me forever it the most user unfriendly app i ever used when i tried to pay for whatever reason it wouldnt take my card when i tried to use another card it completely erased my order i tried to contact ali and it wa virtually impossible i immediately uninstalled the app,2026-02-23 00:27:27,0,ali-express_reviews,unknown
MD Mamunur Rashid Mamun,5,all everything is good,2026-02-22 23:46:36,0,ali-express_reviews,unknown
Anton Litvin,1,bad user interface lot of spam notification difficult to search beyond constant ad and a setting are all scrambled,2026-02-22 23:44:06,4,ali-express_reviews,unknown
Yasmin Karam,1,ive uninstalled the app last week theyve shadow banned me for over 2 month at that point i do not use auto clickers or login from different deviceslocations preventing me from playing my favourite game merge bos the whole app became painfully slow i spoke to customer service 45 time they give me the same spiel but nothing get sorted had enough of them,2026-02-22 23:44:02,1,ali-express_reviews,unknown
Anouar B,1,to much marketing email sm ect report a spam,2026-02-22 22:58:16,1,ali-express_reviews,unknown
Oliver Kelly,3,not bad but ha a few bug,2026-02-22 21:08:27,0,ali-express_reviews,unknown
Omary Mbwana,5,it good platform for buying with good delivery,2026-02-22 20:28:01,0,ali-express_reviews,unknown
taimur abbasi,3,very nice but sometimes the image of the item dont load,2026-02-22 17:56:32,0,ali-express_reviews,unknown
Giulia,3,hiii question is this app entirely about fast fashion product,2026-02-22 17:49:33,0,ali-express_reviews,unknown
Muhammad Masood,1,fake company sell fake product,2026-02-22 17:16:30,2,ali-express_reviews,unknown
Joey J.,3,price are low enough the app ha been a buy now without an option to put into your cart for that reason i deleted it,2026-02-22 15:48:58,0,ali-express_reviews,unknown
John Sweet,1,overall poor quality app and product item received are seem to vary from being ok although often cheap chinese knock offs to not quite matching the description wouldnt recommend if you need decent quality but generally ok for cheap alternative if you dont mind risk of defective product customer service useless if you get something faulty quite likely they now make it virtually impossible to claim for it,2026-02-22 15:20:08,33,ali-express_reviews,unknown
KAYODE AJAYI,5,awesome,2026-02-22 15:01:16,0,ali-express_reviews,unknown
Trae Patterson,1,to much add,2026-02-22 14:52:56,0,ali-express_reviews,unknown
Geørge.6,1,the scam in the system impossibility of redemption many user on platform like reddit report that a soon a the shopping credit become available often at a specific time like midnight they are instantly sold out within millisecond user feel cheated of the time spent playing game to earn the diamond believing the system is designed to be impossible to win potentially using bot or a very small allocation,2026-02-22 14:50:17,5,ali-express_reviews,unknown
Charbel Elias,1,scam platform very bad app with very bad support i bought 2 item i received only one the one that i received come with damage they refuse to refund it and they refused to refund my money for the missing one the delivery is via australia post dont buy from this app i contacted the help centre they do nothing there is no guarantee on your purchase via this app,2026-02-22 13:04:34,3,ali-express_reviews,unknown
Jennifer Ponce,1,they take more money out of your account after you place your order and pay i did the 3 for 99 cent and after shipping fee and tax my total came to 222 i got 222 taken out of my account that night and when i woke up and checked my account they ended up taking 1480 out and it been a hassle to get the order cancelled they cancelled 2 item but still not wanting to cancel the 3rd item,2026-02-22 12:41:05,4,ali-express_reviews,unknown
Dale Brown,3,they have some good stuff but what i find annoying is the constant bombardment of add and whenever i access my cctv app the ali one open within it i find it too annoying so ive uninstalled it,2026-02-22 12:18:26,0,ali-express_reviews,unknown
tuan manh vu,1,it kind of scam show up shipping guarantee will get a coupon if package is late but never seen any coupon customer service is not helpful at all dont waste your time and money here,2026-02-22 08:36:15,3,ali-express_reviews,unknown
Nicole O'hehir,1,i paid so much for a few poster and sticker they cancelled my order and never gave me my money back i emailed the several time and they never got back to me,2026-02-22 08:34:29,4,ali-express_reviews,unknown
Tara w,1,whats the point of offering choice bundle order of item if your courier or mail company cant never deliver the item at all in australia you make ppl spend more money but they dont receive the good then courier are just wasting time delivering to the wrong address or steal them,2026-02-22 07:49:58,1,ali-express_reviews,unknown
Matthias,2,bad support experience told them theyre shipping hazardous and volatile carcinogen that arent labeled in the shop and shipped like regular good without user notice via the regular shipping line of aliexpress in thin packaging but their english or iq is so poor that they dont even understand that two out of two case i had to contact them same issue shipping chemical to end user like that and they arent even aware about the necessary safety protocol,2026-02-22 07:35:28,1,ali-express_reviews,unknown
Jester Lebowski,1,very dirty unsanitary product report of bedbug and mite inside product and packaging dont buy from aliexpress the majority is counterfeit and electrical fire hazard the anime product are counterfeit and illegal to resell in usa their cellphone charger are a fire hazard and dont follow safety law there are report the fabric item have bedbug and mite infesting the customer and their home aliexpress should be sued and shut down aliexpress allows intellectual property theft,2026-02-22 06:52:26,1,ali-express_reviews,unknown
Joseph Farley,1,so im a pretty new user to this app and ive tried buying thing on there however recently i purchased a few item that either didnt work had the wrong description and i even had one purchase that i purchased because the first transaction didnt go through so i purchased it again and they sent me duplicate after receiving these item this company would not take them back and i am out a few hundred dollar and hour and hour of time trying to get them to confirm the return stay away,2026-02-22 06:09:00,4,ali-express_reviews,unknown
Mango Tango,4,love this app especially if you like online aesthetic great for trinket and accessory but the bigger you go the quality scale down i buy press on nail shoe hair clip etc you do get what you pay for but if you do your due diligence you can get some good stuff thing ive bought year ago i still use to this day with no issue if you buy thing that are hard to break regardless of quality eg desk mat enamel pin you trade price for speed tho delivery to u is 24 week,2026-02-22 05:26:03,4,ali-express_reviews,unknown
A'Jewell Davis,1,for the love of god please remove that stupid buy now feature if i cant even have the option to place it into a cart it useless and genuinely ruining the entire app,2026-02-22 04:23:02,1,ali-express_reviews,unknown
Mikolop Harmeszka,1,overall they just try to get a much of your time a possoble fale advertstiment gamification and so on then you will eventually get shadowbanned without further explanation and without real support,2026-02-22 04:16:20,1,ali-express_reviews,unknown
CHICO SMITH,5,satisfaction guarantee,2026-02-22 03:01:00,0,ali-express_reviews,unknown
Nadir Mian,2,tone down the notification even with all but the order update notification off the notification are still continuous and unnecessary and update when it is on it way and delivered is really all that is needed,2026-02-22 02:35:17,1,ali-express_reviews,unknown
S,1,if you buy expensive item cancel after one month no penalty for fraud seller only listing expensive item to hold your money to get interest for long time only good for low price item offer too good but get cancelled after one month if item stolen by their delivery take 2 month to refund,2026-02-22 02:26:10,6,ali-express_reviews,unknown
Bill Graham,1,totally suck ordered an item and 3 week later it still hasnt been shipped get daily message to pay yet payment wa made the day of the order now let see if i get a refund or have to contact the bank for theft,2026-02-22 01:22:11,2,ali-express_reviews,unknown
Dwayne Miller,1,ordered stuff took my money and never received the item,2026-02-22 00:49:58,2,ali-express_reviews,unknown
Timothe Lampkin,1,this app is not the right app the delivery wa taking forever do not recommend,2026-02-21 23:29:57,2,ali-express_reviews,unknown
Thomas Carney,2,never buy clothes or pokemon card they are fake,2026-02-21 22:21:44,0,ali-express_reviews,unknown
Ron Meikle,1,app wont show any category to the right of automotive just show the same stuff not handy if youre looking for tool,2026-02-21 21:14:41,1,ali-express_reviews,unknown
S “S N” Nadaraja,2,the site is user unfriendly there is no logo to go back to my order instead of shipped and to be shipped are the logo which doesnt help much tracking is a joke email doesnt have any current tracking number once reached local airport so expected delivery is unknown this site need more work to do to make it usable,2026-02-21 21:12:57,1,ali-express_reviews,unknown
Peter Street,1,you have lost many a sale by not allowing me to add thing to a cart and forcing me to buy now instead i just dont buy anything at all really dumb of you id honestly pay more for the item just to able to put in in my damn cart,2026-02-21 21:08:13,1,ali-express_reviews,unknown
Jackson,5,excellent experience,2026-02-21 21:06:10,0,ali-express_reviews,unknown
Afzaal Mian,5,i had issue with aliexpress seller but resolved by aliexpress help centre thank you for refund,2026-02-21 20:07:23,0,ali-express_reviews,unknown
Rigz143 Boykin,1,i thought it wa great till i bought a labubu n now they suddenly cant find my address ugh all the other package made it fine why this one total ripp off it say contact carrier and it all in chinese so cant contact them total ripped off please help,2026-02-21 20:03:41,1,ali-express_reviews,unknown
Dark AlchemyXEX,1,lost 9800 from a stolen package aliexpress said i got it and there nothing further they can do i am done with aliexpress update i did reply to aliexpress they refused to refund me directed me to the courier whom stated it wa delivered to me went back and forth with no resolution,2026-02-21 19:59:01,4,ali-express_reviews,unknown
Rohit D,1,easy to use and find item never crashed straight forward with order update but customer service another ballgame when i ran into problem with an order after sharing clear photo of a wrong item sent supplier original packaging and explicitly showing the issue with a measuring tape they asked to provide date stamped video of me unpacking the item ridiculous save yourselves a headache and buy from a reputable source customer service here is non existent,2026-02-21 19:34:24,3,ali-express_reviews,unknown
George Corris,4,i like the way thing work with out the app,2026-02-21 19:09:41,0,ali-express_reviews,unknown
Stephen Allen,5,product arrived within timescale a described and in good condition,2026-02-21 19:07:13,0,ali-express_reviews,unknown
Celine Murray,1,avoid good for selling fake good especially android device with the software nowhere near what it supposed to have then returning something they give you a photo return label that youll have to print yourself a the mail company may not do,2026-02-21 18:16:37,1,ali-express_reviews,unknown
Adams Mallory,1,i never down loaded this app i got hacked,2026-02-21 16:21:38,2,ali-express_reviews,unknown
Femi Femlad,3,good app cheap and affordable but i suggested u should be reduce the shipping fee i would buy good of 300 and the shipping fee is 2000 pls do something about it,2026-02-21 16:07:09,0,ali-express_reviews,unknown
Riva Levitt,1,good value find but look carefully the delivery charge could be 3 time the cost of the item the homepage is not user friendly they have the choice on random object with low minimum compared to similar site recently if item doesnt arrive or is damaged a photo is not enough you have to supply sometimes impossible proof like impossible post office document it wont take responsibility for your bad packaging no list of item on package no late compensation just lost 1 more,2026-02-21 16:03:27,10,ali-express_reviews,unknown
Alan Morris,5,aliexpress is an excellent easy to use clear to understand app that work well for my need when shopping on this platformapp developer have done a good jobthank youam,2026-02-21 15:55:28,0,ali-express_reviews,unknown
S A,1,worst customer service ever i have deleted my account after 10 year day after day they get worse than yesterday you tell them that your package is not arrived you have cctv and still they say more prove more prove at the end you didnt received your package lost your hard working money and dealing with customer service which is not taking a sec to read understand your dont waste your money go to temu amazon allegro etcjust read their replay and it showed all,2026-02-21 14:40:19,2,ali-express_reviews,unknown
Nikola Jovanović,3,traže mi da platim još iako je sve plaćeno i cena svega je bila ispod 5000 dinara što je manje od 50 evra,2026-02-21 14:12:56,3,ali-express_reviews,unknown
NIRO SAN,5,perfect shopping app,2026-02-21 14:08:44,0,ali-express_reviews,unknown
Travis Bone,5,usually pretty good always ordering something off of this app,2026-02-21 13:30:20,0,ali-express_reviews,unknown
Shah Alom,4,good,2026-02-21 13:00:59,0,ali-express_reviews,unknown
Sam Austin,1,so many scammer i got a bad product but aliexpress wouldnt send a courier to pick up the return they expected me to post it back to china wait for an approved refund i contacted customer service 6 time each time they refused to send a courier aliexpress 6,2026-02-21 12:48:06,4,ali-express_reviews,unknown
Tokuijin,1,i still havent received my refund and the customer service is abysmal,2026-02-21 12:36:59,3,ali-express_reviews,unknown
Penelope,5,i love aliexpress i have ordered many many time and have always received my order although some item take a while to arrive make sure you read product specification about item to ensure you are getting what you think you are ordering,2026-02-21 11:29:34,1,ali-express_reviews,unknown
Rayna Stoyanova,1,is just the next fake app the price are expensive the description is aways incorrect the searching algoritem present pear when you search tommatos but the worst thing that they claim buyer protection if your item delay whicj is not true anx if you want to contact the support to ask about it simple the is no option to reach the support or if there is is heeden somewhere deeply just avoid it aliexpress is not what wa year ago,2026-02-21 11:22:06,4,ali-express_reviews,unknown
Norbert Gal,1,my parcel got lost by evri had an email confirming this and still aliexpress said not enough proof to get a refund money gone im wasting my time chasing up on refund they should talk to each other,2026-02-21 11:04:29,2,ali-express_reviews,unknown
Han Sytsma,3,the app is getting worse by the day all kind of unwanted popups fast checking isnt possible anymore because of all thes unwanted rubish,2026-02-21 11:02:32,3,ali-express_reviews,unknown
Peter,5,great app great price great service always check around for the very best price any platform like this watch out if seller say offer deal outside platform say no only order via platform protect yourself,2026-02-21 10:54:22,0,ali-express_reviews,unknown
Wasimgondal9 Gondal,5,aliexpress is a very good app i purchase many time from this app very fast delivery and if you cancel your parcel they will refund you back soon only the problem on this app the people show you in the picture other thing but when you try to purchase devil and you different before you purchase you have to make sure this is the same item are different,2026-02-21 10:11:45,0,ali-express_reviews,unknown
Pseudonymous,1,customer support is garbage time wasting human who give robotic response and dont directly address issue no respect for customer time or effort senior rep dont address problem they just copy and paste a script edit in response to aliexpress reply where do you think i came from to have this experience i complain about terrible customer service and robotic reply that dont address the actual concern and your response is to refer me to the same customer service,2026-02-21 09:57:59,3,ali-express_reviews,unknown
A Google user,1,be careful when you buy anything fragile from aliexpress if possible open the item in the presence of the courier agent to confirm it intact aliexpress will blame you for the broken item,2026-02-21 09:04:46,4,ali-express_reviews,unknown
Cyphon,5,wow this app is a 10 out of 10 each and every order i make is safely delivered to me,2026-02-21 08:11:58,1,ali-express_reviews,unknown
Mark Pettengill,5,a you can tell i love window shopping here,2026-02-21 07:20:06,0,ali-express_reviews,unknown
*Chrissy* R,5,love this shop,2026-02-21 06:12:18,0,ali-express_reviews,unknown
Dinesh Mirpuri (D'Gaia),1,horrible experience to verify when they say they have sent email nothing come to the email at all,2026-02-21 05:12:53,2,ali-express_reviews,unknown
G H,1,scammer are abundant they will mail you an empty package or a piece of trash in the package it impossible dealing with aliexpress to get a refund so youre left to try and work it out with your bank,2026-02-21 05:09:11,1,ali-express_reviews,unknown
Ankit Kapuria,1,worst customer service ever,2026-02-21 04:40:44,2,ali-express_reviews,unknown
Brittany Behnk,2,there price are way to high and there deal are still hight,2026-02-21 04:25:41,1,ali-express_reviews,unknown
microRiZu,1,item cost to pakistan 10 tax 15 what a joke all item are affordable at first glance then at checkout you pay at least 90 to 150 of item actual value it not even funny it wasnt like this back in early 2025 i ordered many thing fix your shipping im ordering item from chinese seller and have to pay 050 at most upon receiving parcel to my door aliexpress ha become a big joke maybe use yunexpress,2026-02-21 02:21:18,3,ali-express_reviews,unknown
Jo Mutt,1,didnt recieve an item got a empty bag with a slit in it and a shipping label no refund yet,2026-02-21 00:52:03,1,ali-express_reviews,unknown
Goodnews Okesola,5,enjoy ordering something from this app very trusted,2026-02-21 00:32:33,0,ali-express_reviews,unknown
tsukwii,5,love this app ive been using it for about two year now and everything ive ordered ha mostly arrived without any problem the interface of each section is great and the purchaserefund method is just a good i recommend buying here ᴗ,2026-02-21 00:21:31,0,ali-express_reviews,unknown
Imiennik Nazwijski,1,gdzie night mode,2026-02-20 23:46:47,0,ali-express_reviews,unknown
Md Mehedi12,1,ভল ন,2026-02-20 22:15:56,0,ali-express_reviews,unknown
Daniel,1,this app suck i give specific information and am both ignored and led on a goose chase no more wasting time here see ya,2026-02-20 22:03:19,0,ali-express_reviews,unknown
Tori,1,so i ordered three item in november right it said it would be delivered in december side note never received anything it is now february about to be march never order from here shein or temo is wayyyyy better pls dont waste your money,2026-02-20 21:45:15,1,ali-express_reviews,unknown
Jennifer McBride,1,won one of the game wa told not receiving prize not available in my region what,2026-02-20 20:51:49,0,ali-express_reviews,unknown
Who Who,1,i have ordered from them twice the first time it came in late and damaged the second time i have yet to receive my package no way to get customer service if you order plan on waiting for a few week and then have to cancel your order also the website is almost impossible to read the print ive tried everything to increase it on my phone,2026-02-20 19:14:24,0,ali-express_reviews,unknown
Taran Deol,1,worst customer service,2026-02-20 18:58:00,0,ali-express_reviews,unknown
Danice Dolar,1,my birthday is in ten day and i still need my package to arrive before it but on the app it say that it ha been delivered when it clearly hasnt been also when i tried contacting the courier they did not answer and ive been trying for the past two day,2026-02-20 18:26:30,0,ali-express_reviews,unknown
Marlene Stemple,3,it ok but cant play game on my tablet cause the game is large or just doesnt fit,2026-02-20 17:21:14,0,ali-express_reviews,unknown
osama daou,1,useless in lebanon supper high shipping rate,2026-02-20 15:17:00,0,ali-express_reviews,unknown
Night Yuu,1,everything is suddenly unavailable you search for something and ti suddenly gone,2026-02-20 14:46:06,0,ali-express_reviews,unknown
Ruan Rhind,1,aliexpress promotes buyer protection but my 1830 item wa lost after the seller authorised the courier to dump it unattended outside my unit in a publicly accessible complex i wa never told authority to leave wa enabled tracking showed delivery for 12012026 this happened 712026 when i wasnt home without requiring signature when i returned the package wa gone despite clear proof ae refuse a refund and try to make me pay for the seller mistake my response in new review,2026-02-20 12:49:52,3,ali-express_reviews,unknown
Eugen Pries,3,overall pretty good but notification for message from seller keep pinging even tho message from them are blocked deleting that message seemingly worked but opening the app after awhile cause notification to trigger again and guess what message reappears also when searching for an item you select it then you select a store that sell it then when looking around that store going back return you 2 step back to search result instead back to store main page very inconvenient,2026-02-20 12:06:41,1,ali-express_reviews,unknown
John Westray,1,although they have great price and a great choice you use them at your own risk i have had a number of parcel delivered not containing what i ordered on one occasion i received a wooden fork instead of the inverter i ordered the seller doe this so that a proof of postage is available customer service is hell to deal with avoid there are better trader available,2026-02-20 11:56:12,2,ali-express_reviews,unknown
A Google user,1,be very carefull you are ordering what you want item and price are not a they seem my purchase wa incorrect but couldnt locate sale invoice to claim refundreturn seller and aliexpress were both asked for help but both had unrealistic demand and offered no assistance a hit and miss company which should be avoided lacking professionism,2026-02-20 11:55:26,4,ali-express_reviews,unknown
Ofer Shemesh,1,very poor customer service the business ignore the customer if a product doesnt get to to customer the business ignore him and doesnt refund beware im editing to let you all know that aliexpressed reached out to me and still didnt take responsibility for anything good job folk,2026-02-20 10:29:36,1,ali-express_reviews,unknown
Michael York,1,you never know what will happen when you click on something,2026-02-20 10:04:09,0,ali-express_reviews,unknown
Timothee Cox,1,i want my refund back it been since december,2026-02-20 09:48:10,0,ali-express_reviews,unknown
Woofles Nookington,1,if i ever get my refund ill bump the review up to 5 star,2026-02-20 09:35:04,0,ali-express_reviews,unknown
Vaeh,5,so much katy perry thing,2026-02-20 08:44:15,0,ali-express_reviews,unknown
Glenda R,4,a little better than temui wish id spent all that money here,2026-02-20 07:05:19,0,ali-express_reviews,unknown
Dean K,1,so sorry i told yall ggod thing about shopping here past tent so far im starting to like aliexpress better than shopping at amz the shipping time is a little longer but i expect what i get when i order from here for some reason so far they havent did me wrong now oops wa i wrong it a big scam community they ship out stuff it doesnt get delivered they promised they help you and they dont they dont stand behind their customer at all on time when you really need it my guess,2026-02-20 06:37:29,1,ali-express_reviews,unknown
Ion Popescu,2,chaotic,2026-02-20 06:25:10,0,ali-express_reviews,unknown
Fozan Z,1,waste of time money and effort the new builtin delivery address locator for saudi arabia is misleading when i choose my address it provides the wrong national address on the other hand the local cheap courier who contracted with aliexpress they only read the national address and say it is in a remote area they dont bother to read the detailed written address thats why i dont get my purchased item delivered to me i can not even contact the courier because their name were left blank,2026-02-20 06:09:37,3,ali-express_reviews,unknown
Ryan Barron,5,great made many good purchase for myself and my vulcan 650,2026-02-20 05:01:26,0,ali-express_reviews,unknown
E.S. Roarke,1,this ha to b run by temu decided to download the app and every so called new account offer said i wasnt eligible i didnt live in an area that wa eligible or the item i clicked on from an ad wasnt available to me to check back later the free gift for 1st time user wa also a clickbait scam the page come up but im not eligible yo scroll through it so why the hell dont they just stop all the b instead of basically scamming people,2026-02-20 04:35:24,61,ali-express_reviews,unknown
Mehrzad,5,great price,2026-02-20 04:17:09,0,ali-express_reviews,unknown
neutral,4,great app neve had problem buying from this it just another ecommerce that give you access to a lot of seller best tip is o buy from trustedwell rated store recommed,2026-02-20 02:08:19,0,ali-express_reviews,unknown
